
众媒时代,众媒时代，就是一个大众参与的媒体时代。互联网将传统媒体垄断而单一的传播方式彻底颠覆。人人都可以通过互联网成为内容的制造者、传播者。每个人都是媒体，人是种子，媒体变成了土壤。当我们的信息入口被朋友圈霸占，当我们的眼睛只看得到10W+，当我们不可抑制地沉浸在一次次的“技术狂欢”中，当人人都可以举起手机直播突发现场，当未来的头条由机器人说了算……内容正生生不息地以各种可能的形式出现，我们正彻头彻尾地进入一个内容分发的全新时代！我们称之为“众媒时代”。在新时代里，传统媒体的生存方式被彻底瓦解，Facebook、苹果、Google巨头入侵，虚拟现实、无人机、可穿戴设备暴风来袭，内容业被裹挟进技术、资本、平台的多重博弈中。谁能苟活？谁在转型？谁注定被淘汰？！一本真正透析未来内容业趋势与走向的洞察之作，人人都是传播者的年代里，我们如何传播内容获取关注，海量数据+海外观察+腾讯创新案例，与你一同走进“众媒时代”。
认同的力量,《认同的力量》(第2版)一经出版即在全世界引起强烈的反响，到目前已经翻译成12种语言，发行量超过100万册。卡斯特因此被欧盟聘为经济顾问。英国著名社会学家，英国首相布莱尔的顾问安东尼·吉登斯如此评价此书：“此书堪与马克斯·韦伯的《经济与社会》相媲美。亚当·斯密为古典资本主义命名，卡尔·马克思为垄断资本主义命名，曼纽尔·卡斯特为信息时代命名。”曼纽尔·卡斯特（ManuelCastells）古根海默（Guggenheim）会员，欧盟执委会委员。曾获得莱特·米尔斯奖和海伦·林德奖。&#34;信息时代三部曲&#34;是曼纽尔·卡斯特毕15年之功、集各家之长撰写的对于信息时代的思考，已经被翻译成20种文字。《认同的力量》是其&#34;信息时代三部曲&#34;的第二部，是对全球化与网络化背景下，国家、民族、社区与个人身份认同的阐述。呈现在读者面前的这个中文第二版，是卡斯特2004年修订的。与第一版相比，第二版补充了许多重要的内容，如有关基地组织、美国&#34;9·11&#34;之后的国际政策走向、21世纪以来的全球化趋势等，是研究了解信息时代新动向的一部不可多得的专著。提示当代文明系统之逻辑，理清信息化社会之意义，全方位展示了信息时代所面临的所有问题，并提出了相应的对策及解决方法。当代最具影响力的全面论述全球性的经济、政治与社会变迁理论，诠释当代新技术与新经济发展的力作：曼纽尔·卡斯特的三卷本《信息时代三部曲》。这是一套既深刻又浅显易懂的原创性重要著作。
长尾理论2.0,"《长尾理论2.0》是克里斯·安德森对所有问题最明确的回答。在此书中，他详细阐释了长尾的精华所在，揭示了长尾现象是如何从工业资本主义原动力——规模经济与范围经济——的矛盾中产生出来的。长尾现象虽然是明显的互联网现象，但其商务逻辑本身，却是从工业经济中自然而然“长”出来的，网络只是把酝酿了几十年的供应链革命的诸多要素简单地结合在一起了。同时，长尾理论转化为行动，最有力、最可操作的就是营销长尾，通过口碑营销，长尾理论将在不可能情况下实现销售。所有的行业都有无限多样化的顾客。品种多样化趋势推动了从机构到个人的权利转移，在这一过程中控制着网络对话的人不是营销人员，而是用户。营销长尾带来了可信任的、真实的、自然发展的、自下而上的、基层民众的意见，并最终影响到21世纪消费者的行为。建议所有的商务人士都仔细研读这本“杰出而又及时的著作”。长尾理论是众多企业成功的不二法门，它将改变企业营销与生产的思维，带动新一波商业势力的消长。而长尾理论的影响不仅限于企业战略，也将左右人们的品位与价值判断。大众文化不再万夫莫故，小众文化也将有越来越多的拥护者。唯有充分利用长尾理论的人，才能在未来呼风唤雨。点击链接进入新版：长尾理论点击链接进入英文版：LongTail,The,RevisedandUdatedEdition:WhytheFutureofBusinessisSellingLessofMore"
阿里巴巴,"阿里巴巴的故事在中国已是家喻户晓，马云的个人魅力和非凡的商业头脑也早已声名远扬。而一千个人眼中会有一千个不一样的马云,一个外国投资人、咨询顾问眼中的马云和阿里巴巴会是什么样的？1994年就来到中国，阿里巴巴创业早期的咨询顾问克拉克先生将阿里巴巴帝国崛起过程中他的见闻、感触和思考结合深入的访谈、研究写成了这本书。书中既可以读到阿里巴巴艰辛的创业历程、惊心动魄的商业对垒，也不乏有趣好玩儿的背后故事。他多年在中国生活的经历，加上投资银行、咨询公司的工作背景，使得这本书的切入角度独特新颖，为我们呈现了一个更为立体的阿里巴巴：马云用不到20年的时间从默默无闻的英语教师成为中国屈指可数的商界巨擘，他成功的秘诀在哪里，创业过程中有哪些问题也让他苦恼不已？从创办翻译社到建立中国黄页，从搭建B2B平台、成立淘宝、打败eBay再到IPO打破历史纪录，阿里巴巴是如何做到的，阿里模式可以复制吗？在创造奇迹的背后、众人瞩目的背后，有哪些我们曾忽略的细节？当不断有问责声出现之时，马云背负着怎样的压力，事情的真相是什么？资本市场的游戏，谁才是真正的赢家，在创业时马云是如何融资并处理与投资人的关系的？阿里巴巴的触角伸向了越来越多的行业，它搭建的庞大的生态系统是否还能一如既往地所向披靡……作者作为中国经济飞速增长时期的见证人，以宏观角度将人物、事件置于中国的时代大背景下辅以生动的细节和客观冷静的解析，让人读起来醍醐灌顶、畅快淋漓。马云曾说：“阿里巴巴的目标是要成为102年的企业。”要实现这个梦想，今年17岁的阿里巴巴还有很长的路要走。克拉克先生笔耕不辍地记录下了这段激动人心的17年奋斗历程，精彩纷呈，值得一读再读。"
如何打造超级IP,IP时代到来，一本系统阐述IP的力作！什么是IP？怎样打造IP？人物、产品和IP是什么关系？你是否适合打造属于自己的IP？IP如何商业化？《如何打造超级IP》涵盖了互联网IP的精髓与核心内容，从IP是什么讲起，涉及IP识别、IP打造、IP商业化等多个方面，涵盖IP打造的全部环节，讨论了大量经典运营案例，以便读者更好地掌握IP的打造方法。
聊聊架构,我们总是喜欢借鉴别人的架构实践，参考别人的架构图，但体会过的人都知道，由于各家公司的行业背景、发展情况、人力资源都不同，所以真正意义上的架构借鉴难度很大。《聊聊架构》希望揭开事物的外在“表皮”，再现架构深层之理，向读者揭示最本质的架构之道。
创意，未来的工作方式,知识工作者已成过去，创意工作者才是未来工作的本质是创意纵观我们身处的世界，除了自然美景，世间或伟大或平凡的事物，几乎都是人观念革新的产物，它们多数是我们在工作过程中群体创意的产物。从工业时代到知识时代，大多数人通过掌握新知、持续学习，获得社会的认可和回报；但进入以大数据、人工智能、机器人为标志的新时代，单纯的学习已经不能满足社会对人的要求。算法和机器人正在取代人类很多重复性工作，在可以预见的未来，人类的价值与位置是“创意”，因为创意是从无中生有。现在，我们要做的不再只是学习和利用外部的知识，更重要的是，发挥自身的创意潜能，掌握群体创意的法则。本书对百年以来的价值创造群体变迁进行梳理，作者结合自身的丰富实践经验指出，创作者、程序员、管理者、创业者是未来创意人的典型原型，并总结提炼群体创意管理的四要素：个体的创意、创意的组织、创意的体系、创意的产品。本书还提供了一系列创意管理工具、创意思考方法，可作为我们创意工作和生活的的指引。
形式感+：网页视觉设计创意拓展与快速表现,网页设计师从早年的综合性工作中分化出来，形成了相对独立的专业岗位，网页设计也不再是单纯的软件应用，它衍生出了许多独立的研究方向，当网站策划、交互体验都逐渐独立之后，形式感的突破和表现成为网页视觉设计的一项重要工作。随着时代的发展，网页设计更接近于一门艺术。网络带宽和硬件的发展为网页提供了使用更大图片、动画甚至视频的权利，而这些也为视觉设计师提供了更多表现的空间。另外多终端用户屏幕（主要是各种移动设备，手机、平板等）的出现，它让网页视觉设计师不得不重新定义原有的视觉规范。这些变化都趋使着设计师对新形式的渴望与进一步的探索。《形式感+：网页视觉设计创意拓展与快速表现》就是这样一本速食的设计创意与技巧手册。本书可以帮助有一定基础的网页设计初学者或在职者，在遇到设计创意瓶颈时，能够在较短的时间内解决设计上的创意和视觉形式感的问题。不论是应对紧急的工作需求或是求职面试都能够给观者一个新颖的视觉表现。《形式感+：网页视觉设计创意拓展与快速表现》读者是网页设计师，包含狭义的、广义的、“圈养”的、“野生”的，以及网站开发其他环节需要了解网页视觉设计或与之协作的人员（如用户体验设计师、前端页面开发人员等）。
孵化Twitter,[内容简介]一个在挣扎中生存的博客平台Odeo，一小撮龙蛇混杂的无政府主义者员工，经历了怎样的涅槃，摇身一变，成为纽交所最闪耀的上市企业Twitter？一个因打造和出售Blogger而出名的农家小子，一个渴望用编码改变世界的创业青年，一个害羞又满脑子奇怪想法的文身黑客，一个爱开玩笑逗朋友开心的外交家，这四位各有特色的创始人如何从兢兢业业、每日劳作的工程师，成为了登上杂志封面、《奥普拉秀》和每日秀的富裕名人?而在Twitter日益茁壮成长的过程中，他们又是如何为了金钱、影响力、名气和对公司的控制权而争斗不休，最终却失去了对Twitter的掌控，让一位50岁的前喜剧演员夺取CEO的位置？《纽约时报》最受欢迎的科技和商业记者尼克•比尔顿，在Twitter以指数级速度增长时，将读者带到了这个公司的大幕之后。在《孵化Twitter》中，他用史无前例的写作手法和全身心投入的调查方式，对Twitter和Odeo公司的现任和前任员工、政府官员、Twitter高管们的朋友们、其他重要人士和竞争公司同行们进行了几百个小时采访。虽然Twitter公司拒绝正式授权写作此书，但Twitter的现任和前任董事会成员及公司所有四位创始人集体同意接受采访，时长超过65个小时。同时，尼克•比尔顿还研读了成千上万的微博，照片和视频，包括之前采访的的一千多份文件（员工电子邮件、会议室演示、投资文档、合同、员工日历、合伙文件、政府级别交流、即时通讯通信、报纸文章、博客帖子、高度机密的Twitter法律通告，以及内部电子邮件）。成百上千的信息来源、采访、文件和内部邮件，使得尼克•比尔顿勾画出一个如电影般精彩的，关于金钱、权力、友谊、背叛的真实故事——四个朋友如何意外地改变世界，以及他们在此过程中汲取的教训。[编辑推荐]★国内首部源自真实采访的Twitter成长史，中英文版零时差同步上市！★这是一部被Twitter公司拒绝正式授权的作品，这是一个关于金钱，权力，友谊，背叛的真实故事。★《纽约时报》最受欢迎的科技和商业专栏作家尼克•比尔顿亲自执笔，源自对Twitter四位创始人和高管的几百小时采访，参阅一千多份从未披露的内部文件。★《孵化Twitter：从蛮荒到IPO的狂野旅程》英文版在Twitter上市前夕11月5日一经推出就登上各大销售商的排行榜榜首。中文版零时差同步震撼上市！★湛庐文化出品。
Web之困：现代Web应用安全指南,《web之困：现代web应用安全指南》在web安全领域有“圣经”的美誉，在世界范围内被安全工作者和web从业人员广为称道，由来自googlechrome浏览器团队的世界顶级黑客、国际一流安全专家撰写，是目前唯一深度探索现代web浏览器安全技术的专著。本书从浏览器设计的角度切入，以探讨浏览器的各主要特性和由此衍生出来的各种安全相关问题为主线，深入剖析了现代web浏览器的技术原理、安全机制和设计上的安全缺陷，为web安全工作者和开发工程师们应对各种基于浏览器的安全隐患提供了应对措施。
瞬间之美,本书特色：本书通过重现用户面对Web应用时由始至终的完整情境，主要针对Web应用中几乎所有相关元素，例如Search、Screencast、Blog、Wizard、RSS、Rate、TagCloud以及Form的布局、交互甚至客服等都提出了值得借鉴的解决方案。具体通过30多个故事轻松自然地带领读者领会设计者如何百分之百地用心传达以创造美好的用户体验。本书适用于信息架构设计师、交互设计师、Web开发人员使用，资深设计师可将本书用做汇集了设计方法和思路的参考手册。初级设计师以及Web开发人员则可以按照书中的方法直接使用，找到一条通往用户体验设计的捷径。业界评论：1.译者评论：翻译这本书其实也是一个学习的过程。乍看上去似乎书里面没什么很新的理论或者概念，但是作者有一种“大拙若巧、顺其自然”的味道，每一个问题点（也就是书中的一个个故事）最后的解决方案都是千锤百炼的结晶。也就是说，如果你不了解UE，只需按他所说的去做就保准没事；如果你有过研究，那么每个方案背后的方法和思路同样值得学习。它是一本好书，值得我向任何人推荐2.专业人士评论：严格来说这不是一本告诉你从头到尾如何设计Web的书，这一点真是太棒了。我们并不需要某人彻头彻尾地驯服我们的方法、我们的原则、以及我们的个性。然而它却是一本激发我们百分之百用心地与用户交流和思考的好书。书中你见不到一行HTMLJavascritPerlPHPRuby技术代码，作者完全根据自己的亲身经历和设计经验简单直接地告诉我们良好的用户体验，全在于那些完美的“瞬间”。这是一本激发Web设计灵感的枕边小册，值得我们经常翻阅。
超级IP,一切商业皆内容，一切内容皆IP！从迪士尼、airbnb、YouTube、Instagram到微信、Pai酱、芈月传、鹿晗，IP浪潮席卷全球，这不仅仅是互联网领域的革命，更是未来商业的游戏新规则。IP从泛娱乐形态快速渗透新商业生态全维度，正深化为不同行业共同的战略方法，甚至是一种全新的商业生存方式，即IP化生存。超级IP的内核，是辨识度极高的可认同的商业符号，它意味着一种对于打动人心的内容的身份认同，意味着自带势能和流量，自带压强，或者具有足够压强的一种社群商业标签。在这种全新的商业表达中，IP俨然成为商业逻辑的基础设施。以IP为起点，产品、品牌、渠道、用户等商业元素与IP的连接形成场景化的解决方案，赋能商业，同时IP价值不断沉淀，并形成新的商业反哺。在IP的催化作用之下，流量、用户、产品天然整合一体，并形成了极具吸引力的售卖逻辑。《超级IP：互联网新物种方法论》是逻辑思维联合创始人吴声对未来图景的深度思考，深度解构这一移动互联时代新的连接符号和话语体系，帮助企业、品牌、个人迎接IP时代的变革与挑战。
网易一千零一夜,本书是网易杭州研究院项目管理部多年来丰富的项目管理实践总结与干货分享。字字句句凝结了网易项目经理的甘与苦、汗与泪。全书围绕项目管理体系，从敏捷实践、项目立项、需求管理、沟通管理，到计划进度管理、风险管理，真实反映了网易面向互联网产品项目管理实战经验与心路历程。不论你是项目管理新手，还是资深项目经理，都可以从本书中获得启发与借鉴。
场景革命,How-old如何引爆了朋友圈的全民脑洞狂欢？Uber是打车软件，还是入口？为什么“自拍”会成为一个产业？美团如何成为电影票房冠军的幕后推手？商业进入了新物种时代，超级平台之后，PC时代以降，IoT（万物互联）崛起之时，到底什么是新的入口？一系列的颠覆使我们开始正视移动互联时代的品类创造方法，一场孕育已久的场景革命正在发生。《场景革命：重构人与商业的连接》为我们描绘了正在发生的商业革命和支撑场景的四大要素，通过构建场景的“四即”方法论，展现了场景在商业中的应用价值。未来的生活图谱将由场景定义，未来的商业生态也由场景搭建。有优惠券、有活动入口、视频音频链接和场景推荐。这不是本要死得远远的广告书，近似于流行手绘，接近于一次完整的年轻生活方式洞察。
删除,《删除》讲述了遗忘的美德，为读者展现了大数据时代的取舍之道。《删除》从大数据时代信息取舍的目的和方法分别诠释了“被遗忘的权利”。维克托首先回溯了人类追寻记忆的过程，之后提出数字技术与全球网络正在瓦解我们天生的遗忘能力。对此，他考察了促进遗忘终止4大驱动力——数字化，廉价的存储器，易于提取，全球性访问。之后，他提出了当前数字化记忆的两大威胁——信息权力与时间，并给出了应对威胁的6大对策——数字化节制、保护信息隐私权、建设数字隐私权基础设施、调整人类的现有认知、打造良性的信息生态、完全语境化。最后，他提出了一种应对数字化记忆与信息安全的极有可能的关键对策——给信息设定存储期限。《删除》开启了一场“互联网遗忘运动”，让我们始终记得遗忘的美德。这本书告诉我们，在大数据时代，面对海量信息人类该如何取舍，怎样才能构建一个积极而安全的未来。《删除》讲述了遗忘的美德，为读者展现了大数据时代的取舍之道。数字技术赋予了我们前所未有的权利，它也产生了意想不到的可怕后果。facebook上照片会被网络永远铭记，甚至会影响到一个人的职业发展；Google记得所有我们搜索过的信息和时间。数字王国记住了那些有时最好被遗忘的信息。删除，大数据取舍之道，就是把有意义的留下来，把无意义的去掉。只有理解了在大数据中，需要的是什么，以及如何判断这种需要，才能举一反三地明白到底为什么要去掉那些不需要的。维克托•迈尔-舍恩伯格，大数据时代的预言家，《科学》《自然》等著名学术期刊最推崇的互联网研究者之一，“大数据商业应用第一人”，拥有在哈佛大学、牛津大学、耶鲁大学和新加坡国立大学等多个互联网研究重镇任教的经历。中国社科院信息化研究中心秘书长姜奇平作序倾情推荐。北京大学新闻与传播学院副教授胡泳、中国科学院理论物理研究所研究员李淼、麻省理工学院教授大卫•克拉克、国际著名信息隐私权专家保罗•施瓦茨、斯坦福大学互联网与社会中心创办人劳伦斯•莱斯格、波士顿咨询公司高级副总裁菲利普•埃文斯联袂推荐《删除》一经出版，即获得美国政治科学协会颁发的“唐•普赖斯奖”，以及媒介环境学会的最高荣誉“马歇尔•麦克卢汉奖”，同时受到《连线》《自然》《华尔街日报》《纽约时报》等各大权威媒体广泛好评。《删除》洞见了“被遗忘的权利”，探索了大数据时代人类该如何构建积极而安全的未来。
SRE: Google运维解密,大型软件系统生命周期的绝大部分都处于“使用”阶段，而非“设计”或“实现”阶段。那么为什么我们却总是认为软件工程应该首要关注设计和实现呢？在《SRE：Google运维解密》中，GoogleSRE的关键成员解释了他们是如何对软件进行生命周期的整体性关注的，以及为什么这样做能够帮助Google成功地构建、部署、监控和运维世界上现存最大的软件系统。通过阅读《SRE：Google运维解密》，读者可以学习到Google工程师在提高系统部署规模、改进可靠性和资源利用效率方面的指导思想与具体实践——这些都是可以立即直接应用的宝贵经验。任何一个想要创建、扩展大规模集成系统的人都应该阅读《SRE：Google运维解密》。《SRE：Google运维解密》针对如何构建一个可长期维护的系统提供了非常宝贵的实践经验。
硅谷之火,我们今天正处于这样一个时代：充满幻想的人们发现他们获得了他们曾经梦寐以求的力量，并且可以利用这个力量来改造我们的世界。这是个转折的时代，跨国公司迷失了发展方向，而小企业家却举起了计算机革命的大旗，成了开拓未来的先锋。在这个时代里，计算机奇才的脸上露出了胜利的微笑，胸怀大志者成了富有理想的人，而富有理想的人则成了亿万富翁。这是一场真正的革命，它促使人们变得伟大，变得富有而充满理想，自豪而富于爱心，努力实现前人从未达到的目标，乘风破浪去夺取这场计算机革命的胜利。
My Life as a Night Elf Priest,"WorldofWarcraftraidlybecameoneofthemostoularonlineworldgamesonthelanet,amassing11.5millionsubscribers—officiallymakingitanonlinecommunityofgamersthathadmoreinhabitantsthanthestateofOhioandwasalmosttwiceasoulousasScotland.It&#39;samassivelymultilayeronlinegame,orMMOingamerjargon,whereeachersoncontrolsasinglecharacterinsideavirtualworld,interactingwithothereole&#39;scharactersandcomuter-controlledmonsters,quest-givers,andmerchants.InMyLifeasaNightElfPriest,BonnieNardi,awell-knownethnograherwhohasublishedextensivelyonhowtheoriesofwhatwedointersectwithhowweadotandusetechnology,comilesmorethanthreeyearsofarticiatoryresearchinWarcraftlayandcultureintheUnitedStatesandChinaintothisfieldstudyoflayerbehaviorandactivity.Sheintroducesustoherresearchstrategyandthehistory,structure,andcultureofWarcraft;arguesforalyingactivitytheoryandtheoriesofaestheticexeriencetothestudyofgamingandlay;andeducatesusonissuesofgender,culture,andaddictionasartofthelayexerience.NardiaintsacomellingortraitofwhatdrivesonlinegamersbothinthiscountryandinChina,whereshesentamonthstudyinglayersinInternetcafes.BonnieNardihasgivenusafreshlooknotonlyatWorldofWarcraftbutatthefieldofgamestudiesasawhole.Oneofthefirstin-dethstudiesofagamethathasbecomeaniconofdigitalculture,MyLifeasaNightElfPriestwillcaturetheinterestofboththegamerandtheethnograher."
社群营销,互联网正从“物以类聚”，走向“人以群分”的时代。秋叶等人的“社群营销”，并非单纯靠社群卖东西，而是建立一种去中心化的、自行运转的生态。让“同好”们形成紧密的联系，创造出海量营销机会。主要内容：【从0到1】回归本源：再论，什么是社群？精准定位：5W1H梳理社群目标建群实践：走好关键的四步【从小到大】步步为营：避开扩张的五大陷阱团结协作：打造高效运营团队人气至上：保持社群活跃度打通线下：打造落地核心团队【社群经济】关键抉择：免费社群与付费社群变现实操：社群营销的七种战术未来之路：通往社群的新阶段
移动的帝国,日本是全世界移动互联网最发达的国家之一，堪称移动的帝国。在手机游戏、手机支付、移动医疗、移动电子商务、手机电视等方面，日本都充当了全球移动互联网的试验田。曾经傲视全球的日本运营商将怎样面对转型的挑战？iPhone来势汹汹，如何打破封闭的日本移动互联网体系？日本在智能手机时代的手机游戏、O2O、移动医疗、移动广告等方面，涌现出了哪些值得借鉴的商业模式？本书作者团队先后数次前往日本调研，拜访了多位日本移动互联网的重量级人物，在本书中第一次对日本移动互联网发展和现状进行了全景式的展现，深入解读其经验教训，为我国移动互联网产业的发展带来启迪。
